"Gmove","Jean-Marc Aury","LIS/R&DBioSeq","CEA/Genoscope","2, rue Gaston Crémieux - 91000 EVRY","jmaury@genoscope.cns.fr"," "," "," "," "," ","""Gmove (Gene Modelling using Various Evidence) is an eukaryotic genome annotation tool. As a combiner it uses results of biological data mapping to generate genes models. Compare to ab initio tools, it is not using statistical approach to predict genes, it results in an easy to use tool, free of training step. 

Gmove evolves with sequencing technologies, and it will be soon capable to take long reads mapping to predict alternative isoforms.""","Tool","It can take in input diverse data such as RNAseq, cDNA alignment, proteic alignment and ab initio prediction and produce potential coding genes. Gmove combines data and finds a consensus; it takes advantage of all types of sources. Regarding common ab initio predictor, Gmove needs no training. As Gmove uses alignment data, it is not dependent on canonical splicing sites. ","Gmove is a combiner which provide an annotation for eucaryotic genomes. Any international researcher working on structural annotation would be interested in using this tool.","None","2015","Mature","The tool is freely distributed under the license CeCILL FREE SOFTWARE LICENSE. It can be find at the website http://www.genoscope.cns.fr/gmove/","Gmove uses standard file format in genome annotation : as input Gmove needs a fasta file representing the genome to annotate and resources in GFF. The output annotation is provided in GFF.","Gmove is routinely used in the gene prediction workflow at Genoscope. Several eukaryotic genomes were annotated with the tool, and some of them are now publish or underpublication.","3","3","""Madoui, M.-A., Poulain, J., Sugier, K., Wessner, M., Noel, B., Berline, L., … Wincker, P. (2017). New insights into global biogeography, population structure and natural selection from the genome of the epipelagic copepod Oithona. Molecular Ecology, 38(1), 42–49. http://doi.org/10.1111/mec.14214
"""," ","None","None","None","This work was supported by the Genoscope, the Commissariat à l’Energie Atomique et aux Energies Alternatives (CEA), and France Génomique (ANR-10-INBS-09-08).","be registered as an ELIXIR service (in its SDP)"," "
"RPBS","Tuffery Pierre","INSERM UMR-S 973","Univ. Paris Diderot","35 rue H. Brion, case 7113, 75205 Paris cedex 13","pierre.tuffery@univ-paris-diderot.fr"," "," "," "," "," ","The Ressource Parisienne en BioInformatique Structurale (RPBS) is a platform of web servers, tools and databases in the area of Structural Bioinformatics. The main areas of focus are:

- The prediction of peptide structure (PEP-FOLD)

- In-silico screening of large compound libraries (FAF-Drugs)

- The structural prediction of protein-peptide complexes (pepATTRACT, PEP-SiteFinder)

- Structure similarity searches (BCSearch)

- A database of bacterial peptides (BactPeptDB)

- The structural prediction of protein-protein complexes using evolutionary information (InterEvDock)

The mission of the RPBS platform is method development, service deployment and training within the domain of structural bioinformatics.

A complete overview of the RPBS platform is available at http://bioserv.rpbs.univ-paris-diderot.fr.


","Data
Tool
Compute
Interoperability
Training
","The RPBS platform is set up as a structural bioinformatics portal, providing direct access to all services, tools, databases, including help pages and descriptions. Using the RPBS portal, structural biologists can launch jobs for peptide modeling, protein modeling, in silico screening, and structural similarity searches. All web services are available via the Mobyle framework, which allows the user to monitor their job results and ask for help if needed. In addition, a collection of software tools and resources is available for download.


","The RPBS targets the international structural bioinformatics community. The platform serves about 85 000 jobs per with year, with > 90 % of the users living outside France (http://bioserv.rpbs.univ-paris-diderot.fr/presentation.html#mobyleatrpbs).


","Structural bioinformatics","2004","Mature","All web services are freely accessible, and registration of personal data is completely optional (for example, it is possible to provide us with an email address for online help and job management). These personal data are only stored on our infrastructure and are not shared with third parties.

In addition, a collection of software tools and resources is available for download. Several tools are available under Open Source licenses (e.g pepATTRACT, InterEvDock). We maintain an internal Docker repository for our tools, which will be published to a public repository when ready.

Our Mobyle framework saves all job parameters as XML web forms, accessible to the user. The user has the option to upload datasets of different formats (PDB, FASTA, etc.) as data bookmarks, that can be shared between web forms. Request for help are available directly from within the web forms.


","Our Mobyle framework saves all job parameters as XML web forms, accessible to the user. The user has the option to upload datasets of different formats (PDB, FASTA, etc.) as data bookmarks, that can be shared between web forms. Request for help are available directly from within the web forms.

Calculation equipment and storage arrays are highly redundant and protected by inverters and climate control. Several monitoring utilities (nagios, shinken, etc) are deployed.

Each service is assigned to one PI in charge of the dialog with the users and service maintenance.

","The platform serves about 85 000 jobs per with year, with > 90 % of the users living outside France (http://bioserv.rpbs.univ-paris-diderot.fr/presentation.html#mobyleatrpbs). ","350","12","350 cites since 2014  - 70 cites a year (google scholar)
12 service publications since 2014

1/ Online structure-based screening of purchasable approved drugs and natural compounds: retrospective examples of drug repositioning on cancer targets.
Lagarde N, Rey J, Gyulkhandanyan A, Tufféry P, Miteva MA, Villoutreix BO.
Oncotarget. 2018 Aug 17;9(64):32346-32361. doi: 10.18632/oncotarget.25966. eCollection 2018 Aug 17.

2/ InterEvDock2: an expanded server for protein docking using evolutionary and biological information from homology models and multimeric inputs.
Quignot C, Rey J, Yu J, Tufféry P, Guerois R, Andreani J.
Nucleic Acids Res. 2018 Jul 2;46(W1):W408-W416. doi: 10.1093/nar/gky377.

3/ The pepATTRACT web server for blind, large-scale peptide-protein docking.
de Vries SJ, Rey J, Schindler CEM, Zacharias M, Tuffery P.
Nucleic Acids Res. 2017 Jul 3;45(W1):W361-W364. doi: 10.1093/nar/gkx335.

4/ PEP-FOLD3: faster de novo structure prediction for linear peptides in solution and in complex.
Lamiable A, Thévenet P, Rey J, Vavrusa M, Derreumaux P, Tufféry P.
Nucleic Acids Res. 2016 Jul 8;44(W1):W449-54. doi: 10.1093/nar/gkw329. Epub 2016 Apr 29.

5/ FAF-Drugs3: a web server for compound property calculation and chemical library design.
Lagorce D, Sperandio O, Baell JB, Miteva MA, Villoutreix BO.
Nucleic Acids Res. 2015 Jul 1;43(W1):W200-7. doi: 10.1093/nar/gkv353. Epub 2015 Apr 16.
"," ","SAB: (available on-line on bioserv.rpbs.univ-paris-diderot.fr)
Dr. Gilles Labesse (CBS - UMR 5048 CNRS/INSERM/Université de Montpellier - Montpellier)
Dr. Matthieu Montes (GBA - CNAM - Paris)
Dr. Maude Pupin (LIFL - UMR 9189 CNRS/INRIA/Université Lille1 - Lille)
Dr. Bruno O. Villoutreix (MTi - UMR-S 973 INSERM/Université Paris Diderot - Paris)
Pr. Martin Zacharias (Technische Universität München - München)

Executive Committee:
Dr Pierre Tuffery  (MTi - UMR-S 973 INSERM/Université Paris Diderot - Paris)
Dr Raphael Guerois (CEA - CEA, Saclay)
Dr Jacques Chomilier (IMPMC - UPMC, Paris)
Dr Jean-Christophe Gelly (DSIMB, Univ. Paris Diderot, Paris)
Dr Sjoerd de Vries (MTi - UMR-S 973 INSERM/Université Paris Diderot - Paris)
Dr Julien Rey  (MTi - UMR-S 973 INSERM/Université Paris Diderot - Paris)
","No publicly available Terms of Use (pending).","N/A","INSERM recurrent funding for UMR-S 973
Non recurrent funding from Univ. Paris Diderot
IFB non recurrent funding for targeted projects.

3 permanent staff (1 DR, 2 IgRs), The 2 IgRs have got permanent positions in 2017, supplemented by 1 to 2 PostDocs per year over the past 3 years. Request for a permanent IE position on-going.","be registered in the IFB catalogue of tools
be registered as an ELIXIR service (in its SDP)
support from IFB (action 1.3) expected
","IT support (computation/storage)"
"Genoscope Genomes Web Portal","Jean-Marc Aury","LIS/R&DBioSeq","CEA/Genoscope","2, rue Gaston Crémieux - 91000 EVRY","jmaury@genoscope.cns.fr"," "," "," "," "," ","The service provides ressources to the genomic community. These ressources have been generated during sequencing genome projects conducted at Genoscope. Only public datasets are available from this service. It contains several categories of data like genome or transcriptome assemblies, gene prediction and blat servers. ","Data","A website portal that provides an access to the data generated during sequencing projects conducted at Genoscope. The data are access through a genome browser and can be downloaded as standard files.","International public community, mainly composed of genomicist and bioinformaticians. ","None","2001","Mature","""Freely access to public community through online website
http://jacob.cea.fr/drf/ifrancoisjacob/Pages/Departements/Genoscope/Ressources-bio-informatiques-du-Genoscope.aspx""","Data are available through a genome browser Gbrowse (http://gmod.org/wiki/GBrowse), which is a standard tool to browse genome sequence and their relative annotation. Some additional web page are use to provide further informations like alignments, sequences... Data are downloadable in several standard format like fasta, GFF, and AGP. A helpdesk can be contacted using a mailing list (ggbcns@genoscope.cns.fr).","The website is mainly used by collaborators and the usage is depending of the studied genome. The genome browser of plants, like grape, are popular but some have very little use.","21","21","Brassica napus 10.1126/science.1253435
Trout 10.1038/ncomms4657
Adineta vaga 10.1038/nature12326
Banana 10.1038/nature11241
Black truffle 10.1038/nature08867"," ","None","None","None","This work was supported by the Genoscope and the Commissariat à l’Energie Atomique et aux Energies Alternatives (CEA).","be registered as an ELIXIR service (in its SDP)"," "
"Gmorse","Jean-Marc Aury","LIS/R&DBioSeq","CEA/Genoscope","2, rue Gaston Crémieux - 91000 EVRY","jmaury@genoscope.cns.fr"," "," "," "," "," ","G-Mo.R-Se (Gene Modelling using RNA-Seq) is an approach aimed at building gene models directly from RNA-Seq. It has been published in Genome Biology in 2008, and still used to predic gene models from RNA-Seq data.","Tool","First, candidate exons are built directly from the positions of the reads mapped on the genome (without any ab initio assembly of the reads), and all the possible splice junctions between those exons are tested against unmapped reads : the testing of junctions is directed by the information available in the RNA-Seq dataset rather than a priori knowledge about the genome. Exons can thus be chained into stranded gene models.","Gmorse is a software for gene prediction and any international researcher working on structural annotation would be interested in using this tool.","None","2008","Mature","The tool is freely distributed under the license CeCILL FREE SOFTWARE LICENSE. It can be find at the website http://www.genoscope.cns.fr/gmorse/","Gmorse uses standard file format in genome annotation : as input Gmorse needs a fasta file of the genome as well as RNA-Seq reads in fastq format. The output annotation is provided in GFF.","Gmorse is routinely used in the gene prediction workflow at Genoscope. Several eukaryotic genomes were annotated with the tool, and some of them are now publish or underpublication.","148","5","""Denoeud F, Aury JM, Da Silva C, Noel B, Rogier O, Delledonne M, Morgante M,
Valle G, Wincker P, Scarpelli C, Jaillon O, Artiguenave F. Annotating genomes
with massive-scale RNA sequencing. Genome Biol. 2008;9(12):R175. doi:
10.1186/gb-2008-9-12-r175. Epub 2008 Dec 16. PubMed PMID: 19087247; PubMed
Central PMCID: PMC2646279.
"""," ","None","None","None","This work was supported by the Genoscope and the Commissariat à l’Energie Atomique et aux Energies Alternatives (CEA).","be registered as an ELIXIR service (in its SDP)"," "
"TE-Tracker","Jean-Marc Aury","LIS/R&DBioSeq","Genoscope","2, rue Gaston Crémieux - 91000 EVRY","jmaury@genoscope.cns.fr"," "," "," "," "," ","TE-Tracker is a program for detecting germline transposition events through whole-genome resequencing. We have published the method in BMC Bioinformatics in 2014","Tool","The ressource is a general and accurate computational method for the de-novo detection of germ line TE mobilization from re-sequenced genomes, as well as the identification of both their source and destination sequences. ","The resource is mainly aimed towards the bioinformatics international community.","None","2014","Mature","The resource can be freely accessed by all users on github at https://github.com/institut-de-genomique/tetracker and is distributed under the CeCILL FREE SOFTWARE LICENSE. Check out http://www.cecill.info/ for more information about the contents of this license.","Resource was last updated on the 25th May 2016. Users can formulate questions or report bugs via the 'Issues' section on the github site.","The resource was used for several projects on Arabidopsis thaliana.","9","0","""Gilly A, Etcheverry M, Madoui MA, Guy J, Quadrana L, Alberti A, Martin A,
Heitkam T, Engelen S, Labadie K, Le Pen J, Wincker P, Colot V, Aury JM.
TE-Tracker: systematic identification of transposition events through
whole-genome resequencing. BMC Bioinformatics. 2014 Nov 19;15:377. doi:
10.1186/s12859-014-0377-z."""," ","None","None","None","This work was supported by the Genoscope, the Commissariat à l’Energie Atomique et aux Energies Alternatives (CEA), and France Génomique (ANR-10-INBS-09-08).","be registered as an ELIXIR service (in its SDP)"," "
"OrthoInspector","Lecompte Odile","Complex Systems and Translational Bioinformatics","ICUBE/University of Strasbourg","CSTB ICUBE UMR7357 - Faculté de Médecine - 4 rue de Kirschleger 67085 Strasbourg FRANCE","odile.lecompte@unistra.fr"," "," "," "," "," ","OrthoInspector provides a comprehensive toolbox for evolutionary and comparative studies, as well as a database of pre-computed orthology and inparalogy relationships. As such, we are involved in the international Quest for Orthologs consortium which aims at standardize and benchmark orthology prediction tools. In this context, OrthoInspector was shown to be one of the most balanced methods of orthology inference in terms of precision and recall (Altenhoff et al., Nature Methods, 2016). 

The OrthoInspector database is updated regularly and the latest version (3.0) provides orthology and inparalogy inferences for 23,093,193 proteins from 4,753 complete Reference proteomes from UniProtKB selected according to quality criteria. It makes our database the most exhaustive orthology resource to date in terms of cellular species coverage. For instance, the ELIXIR orthology resources HOGENOM, OMA and OrthoDB include 1470, 2103 and 4667 proteomes respectively. OrthoInspector is also unique in providing multi-level predictions: fine-grained orthology relationships among an extended set of species within each domain (711 Eukaryotes, 3,863 Bacteria and 179 Archaea) and coarse-grained inter-domain relationships among a selection of 317 model species. These model species have been manually selected by experts to include high quality proteomes and well-studied species and also to ensure a good phylogenetic sampling of the three Life domains.

The OrthoInspector toolbox includes original visualization and exploration tools, giving users easy and rapid access to powerful comparative genomics analyses. Users can visualize the phylogenetic distribution of their proteins through a heatmap synthetic view and retrieve protein with similar distribution, which is a unique feature of OrthoInspector. A phylogenetic profiling tool allows to retrieve all the proteins of a species sharing a given distribution and to analyse their role through functional enrichment analysis. OrthoMCL and HOGENOM also offer a phylogenetic pattern search but through a basic user interface in a limited number of species (150 and 1470 respectively). In addition, OrthoInspector is the sole resource allowing to study the evolutionary histories of genes related to a given Gene Ontology term.  

OrthoInspector is registered in the IFB catalog of tools. OrthoInspector entries provide direct links to ELIXIR nodes resources: UniprotKB, Gene Ontology and InterPro. 

We plan to improve OrthoInspector visibility and accessibility in a near future. A cross-reference to OrthoInspector will be added in UniprotKB entries (Phylogenomic section); a mapping procedure is currently studied. Moreover, FAIRification of part of the OrthoInspector resource is planned.  ","Data
Tool
","OrthoInspector provides two main resources. First, the orthology and inparalogy database is a knowledge base containing functional and evolutionary information for 4,753 Reference proteomes from UniProtKB. The model species selected for the cross-domain database have been selected by experts and constitute a precious and reliable resource to perform large-scale comparisons. The database can be accessed online via dedicated web pages and web services (REST API). Second, the toolbox provides access to complex analysis scenarios allowing to explore evolutionary histories of genes and processes. In addition, OorthoInspector is also a standalone package that can infer orthology relations among user’s genomes.","OrthoInspector is a comprehensive International resource for biologist researchers, clinicians and students aiming at studying evolution and distribution of any protein families, either within a life domain or across the three domains. It also allows to study evolution of biological processes and perform genotype/phenotype correlations using phylogenetic profiling. It has already been used for training sessions (Master degree’s students). ","Human data (including Rare Diseases, Copy number Variations, Human cell Atlas)
Plant
Metabolomics
Proteomics
Microbial Biotechnology
Structural bioinformatics
","2010","Mature","The online OrthoInspector database (web site, API and predictions) is licensed under a Creative Commons Attribution-ShareAlike 4.0 International License. We do not use personal data. The OrthoInspector standalone package is licensed under the GNU GPL version 3.","Data throughput: Orthology predictions are available for 4753 Reference proteomes of Uniprot (711 Eukaryotes, 3863 Bacteria and 179 Archaea), representing 23,093,193 protein sequences for a total of 5,5 TB.

Uptime: OrthoInspector has been continuously working and available since 2010, with no significant downtime periods. Availability is ensured by resource allocation and backups. Updates are done on a backup system.

Use of standards: Each protein page can be accessed using Uniprot identifier or access number. For each protein, we provide links to the corresponding UniProt protein page, to the NCBI Taxonomy database, to the Gene Ontology resource and to the InterPro database. Orthology predictions can be retrieved in different formats including the orthoXML, the standard for orthology data. 

Access to OrthoInspector database
- Website: http://www.lbgi.fr/orthoinspector/ for OrthoInspector v2 and  http://lbgi.fr/orthoinspectorv3/ for the new version. 
Data are available in different formats: FASTA, OrthoXML, JSON, XML, CSV, Excel.
- API: We use a Representational State Transfer (REST) API providing access to most data available from the website (documentation available at http://lbgi.fr/orthoinspectorv3/API). 
- FAIRification of part of OrthoInspector database is planned and has been initiated during a ELIXIR BYOD event held in Strasbourg in May 2017.
- FTP: A complete dump of the SQL database can be requested by mail, but is not available for direct download as such dump represents hundreds of gigabytes. The OrthoInspector predictions for the Quest for Orthologs reference set (78 proteomes used for benchmarking purposes) are available for download (in CSV and OrthoXML format) at http://lbgi.fr/orthoinspectorv3/QFO. The standalone OrthoInspector software package can be downloaded (http://lbgi.fr/orthoinspectorv3/download_Package). It is licensed under the GNU GPL version 3.

Last update of the resource:  December 2017

Customer service: Users are invited to contact developers by email for any request to report bug or to suggest improvments. For instance, following user feedback, we have implemented a MySQLite version for the software package. An online tutorial is available for the software (http://lbgi.fr/orthoinspectorv3/tutorials). A benchmark of 6 proteomes is also available to test OrthoInspector installation. ","In the last 2 years, OrthoInspector has been cited by 19 publications (data from Google Scholar).

Number of page views for the current OrthoInspector website (analytics provided by ClustrMap) :
- 195 page views last month from France, Spain, United states, Egypt, Belgium, China, United Kingdom, Germany, Taiwan… 
- 5180 page views since dec 15th 2015. 
","60","337","Linard B, Thompson JD, Poch O, Lecompte O. (2011) OrthoInspector: comprehensive orthology analysis and visual exploration. BMC Bioinformatics 12:11. 
doi: 10.1186/1471-2105-12-11.

Linard B, Allot A, Schneider R, Morel C, Ripp R, Bigler M, Thompson JD, Poch O, Lecompte O. (2015) OrthoInspector 2.0: software and database updates. Bioinformatics 31(3):447-8. 
doi: 10.1093/bioinformatics/btu642

Altenhoff AM, Boeckmann B, Capella-Gutierrez S, Dalquen DA, DeLuca T, Forslund K, Huerta-Cepas J, Linard B, Pereira C, Pryszcz LP, Schreiber F, da Silva AS, Szklarczyk D, Train CM, Bork P, Lecompte O, von Mering C, Xenarios I, Sjölander K, Jensen LJ, Martin MJ, Muffato M; Quest for Orthologs consortium, Gabaldón T, Lewis SE, Thomas PD, Sonnhammer E, Dessimoz C. (2016) Standardized benchmarking in the quest for orthologs. Nat Methods 13(5):425-30. 
doi: 10.1038/nmeth.3830

Nevers Y, Kress A, Defosset A, Ripp R, Linard B, Thompson JD, Poch O, Lecompte O
OrthoInspector 3.0: open portal for comparative genomics
Submitted to the 2019 NAR database issue
"," ","We plan to create a user committee to improve our resources. This committee could bring together orthology data users from the Quest for orthologs consortium.","We don't have publicly available Terms of Use.","No","Funding:
CEE Infradev: Elixir Excelerate (2015-2020)
ANR infrastructure project: “IFB: structural bioinformatics"" (2014-2018)
ANR infrastructure project: BIPBIP: ‘Bayesian inference paradigm: Biology in processors’ (2012-2017)
European Strategy Forum for Research Infrastructures (ESFRI) project: INSTRUCT (2011-2016)
ANR infrastructure project ‘French Infrastructure for Integrated Structural Biology’ (FRISBI) (2011-2016)
ANR project: EvolHHuPro, “Definition of evolutionary histories for the human proteome” (2007-2010)

Number of full time equivalents engaged for the resource:
Last four years: 1.5 full time equivalents/year (a total of 6 full time equivalents for the periods: 4 master students, 2 PhD students, 1 post-doctoral student, 2 engineers, 3 permanents researchers)
Next year: 1.5 full time equivalents (1 PhD student, 1 post-doctoral student, 1 engineer and 3 permanents researchers)

","be registered as an ELIXIR service (in its SDP)
support from IFB (action 1.3) expected
","IT support (computation/storage)
support for the application to become an ELIXIR core resource
"
