"South Green Genome Hub","Droc Gaetan","UMR AGAP","CIRAD","911 avenue Agropolis, BP 6450134394 Montpellier cedex 5 - FRANCE","gaetan.droc@cirad.fr","Rouard Mathieu"," ","Bioversity International"," ","m.rouard@cgiar.org","Our participation in several reference genome sequencing projects has led us to develop crop-specific information systems, so called Genome Hubs, to manage the corresponding genome annotations and linked datasets. Data available are under different forms, from complete genome sequence along with gene structure, gene product information, metabolic pathways, gene families, transcriptomic assays, genetic markers as well as genetic and physical maps. Several Genome Hubs were released: Banana, Cassava, Cacao, Coffee, and others (e.g. Rice, Palm, Grass Magnaporthae) are currently under development. Strong partnerships are engaged with the community to ensure that the latest information in available through the Hubs. Within each international crop community, we actively participate in the building of a community of practice for communicating and sharing information. As an example, we can cite the banana genome hub with connections built with breeding information from MusaBase  (BTI/Cornell University). Another example is the Rice Genome Hub, currently in development, for which we are creating synergies within the International Rice Informatics Consortium.
We opted for GMOD components that are open source, modular, portable and benefiting from a large community support in which we have been involved. We also plugged in-house tools developed by the South Green bioinformatics platform such as SNiPlay, Gigwa, daTALbase, PathosDB, and DiffExDB. Similar resources are Ensembl Plants but at a different scale since we focus only on a subset of priority tropical and mediterranean crops as well as a few pathogens.
","Data
Tool
Interoperability
","On case by case basis, submissions (e.g. RNAseq, GBS, etc.) from an international community of researchers is the adding value of the service (deposition database).
For some hubs, genome manual annotations have been added by experts, using the Artemis annotation tool directly connected to the Chado database (knowledge base).
","Last year, according to Google Analytics, 5,200 different users used the Banana Genome hub, compared to 4,200 for the Coffee Genome Hub. Looking at the geographical level,  48% come from Asia, 28% from the Americas, 17% from Europe (including 30% from France), 4.5% from Oceania and 2.5% from Africa. The order is a little different for Coffee with America at the first place with 47%, Europe 27%, Asia 20, Africa and Oceania 3%. These results show that these resources serve first the in international community and mostly them coming from plant molecular biology and plant breeding. ","Plant","2013","Mature","The service is freely available without any restriction. Users can access the service and use it without any login.  In case, sequences are under embargo before publication, the Hub can also provide a private access upon authentication.

Four genome hubs are the Southgreen's flagship products but there are nine other sites currently in development.
http://banana-genome-hub.southgreen.fr/
http://coffee-genome.org/
http://cocoa-genome-hub.southgreen.fr/
https://www.cassavagenome.org/ ","The Drupal, Tripal , Chado, JBrowse composes the core of the Genome Hub. The Tripal framework provides several data sharing options (XML, JSON, etc.) and APIs.   The Hub relies on URL integration of resources using a common uniquename and semantic terms (e.g. ontology). Other bioinformatic systems are integrated using HTML iframes such as GreenPhyl and Pathwaytools. Updates are performed once new genomic or transcriptomic datasets are available for each community. For instance, the last update was conducted in 2017 for banana
For each Genome Hub, a form is available to report a problem or to make suggestion to improve the website. 
Some trainings are organised with different dynamics according to the communities. 

For instance, a 5-days training course was organised with partners from developing countries after the publication of the banana genome in Montpellier in 2013. 
Two sessions were conducted by CIRAD towards private companies: one in Bogor (Indonesia, July 2017), the other in Kuala Lumpur (Malaysia, November 2017). The goal was to help selection assisted by markers.","Since 2015, the Banana Genome Hub has been cited 55 times in scientific publications and the Coffee Genome Hub 31 times (source google scholar). because the other Hub are not yet published or were published very recently, we consider web traffic statistics to complement. ","86","14","Argout X, Martin G, Droc G, Fouet O, Labadie K, Rivals E, Aury JM, Lanaud C (2017) The cacao Criollo genome v2.0: an improved version of the genome for genetic and functional genomic studies. BMC Genomics 18:730 . doi: 10.1186/s12864-017-4120-9

South Green c. The South Green portal: a comprehensive resource for tropical and Mediterranean crop genomics. Current Plant Biology. 2016.
http://dx.doi.org/10.1016/j.cpb.2016.12.002
 
Dereeper A, Bocs S, Rouard M, Guignon V, Ravel S, Tranchant-Dubreuil,  Poncet V,  Garsmeur O,  Lashermes P, Droc G. (2015) The coffee genome hub: a resource for coffee genome. Nucleic Acids Research doi: 10.1093/nar/gku1108

Droc G, Lariviere D, Guignon V, Yahiaoui N, This D, Garsmeur O, Dereeper A, Hamelin C,
Argout X, Dufayard J-F, Lengelle J, Baurens F-C, Cenci A, Pitollat B, D&#39;Hont A, Ruiz M, Rouard M, Bocs S. The Banana Genome Hub. Database (2013)
doi:10.1093/database/bat035

Guignon V1, Droc G, Alaux M, Baurens FC, Garsmeur O, Poiron C, Carver T, Rouard M, Bocs S. (2012) Chado controller: advanced annotation management with a community annotation system. Bioinformatics. 2012 Apr 1;28(7):1054-6. doi: 10.1093/bioinformatics/bts046
"," ","Currently, the resource does not have a dedicated Scientific Advisory nor user committee. However, the resource is a part of South Green platform and is evaluated like other resources of the platform with a Scientific Advisory board and  user committee. ","No","No","
It was supported by the French ANR through the bioinformatics projet, GNPAnnot and sequencing projects of Banana, Cocoa, and Coffee.  The Cassava Genome Hub was supported by by Agropolis Fondation/AGRO Labex (ID RTB Multi-Genomes Hub 1403-018). 
The Omic resources are sponsored by the CGIAR Research Program for Root, Tubers and Bananas, and Project PAIX (PAthogen-Informed sustainable resistance of cassava against Xanthomonas), financement Agropolis Fondation, PI: B.Szurek. 
The Rice Genome Hub is supported by the CRP (CGIAR Research Program) RICE.
The development of a genome hub represent approximately 2 FTE.
","be registered in the IFB catalogue of tools
be registered as an ELIXIR service (in its SDP)
support from IFB (action 1.3) expected
","IT support (computation/storage)
curation (tools and network of experts)
support for the application to become an ELIXIR core resource
"
"booster","Olivier Gascuel","Evolutionary Bioinformatics","Institut Pasteur","28, Rue du Dr Roux, 75015 Paris","olivier.gascuel@pasteur.fr","Frédéric Lemoine","Evolutionary Bioinformatics","Institut Pasteur","28, Rue du Dr Roux, 75015 Paris","frederic.lemoine@pasteur.fr","BOOSTER is an alternative method for calculating branch supports of phylogenetic trees, using the bootstrap. With large trees and moderate phylogenetic signal, BOOSTER tends to be more informative than the standard Felsenstein bootstrap method.
It is available as a standalone tool, and a web service at https://booster.pasteur.fr . The web service provides access to computation, and does not store results in long terms. Two main phylogenetic workflows are implemented and make the tree inference very easy to the majority of users.
It will evolve in parallel to the standalone tool and new needs of users in terms of visualization.
","Tool
Compute
","Booster provides computation, and no long terms storage of results. The main goals are : 1) Prevent users to install standalone tool and phylogenetic workflows, and 2) Visualize results in a user friendly way.
It is composed of a fronted (implemented in Go), that launches computations on the Institut Pasteur galaxy instance on which all needed tools are installed.
","Booster is intended to international users needing to apply phylogenetic methods (computational biologists, biologists).
","Human data (including Rare Diseases, Copy number Variations, Human cell Atlas)
Plant
Marine Metagenomics
Microbial Biotechnology
","2018","Mature","All users can run Booster publically without login. Running workflows are documented and accessible in a github page, as well as all the galaxy wrappers of the tools.
* Booster is accessible at : https://booster.pasteur.fr
* Booster documentation: https://booster.pasteur.fr/help
* Source code of the web interface: https://github.com/evolbioinfo/booster-web
* Source code of the Galaxy wrappers and workfows: https://github.com/C3BI-pasteur-fr/ngphylogeny-galaxy
","i. The service is monitored via notifications when problems appear. It uses main standard formats as input and output (Phylip, Fasta, Nexus, Newick). Results are accessible via stable and unique URLs;
ii. The service has last been updated on 27th September;
iii. Users may contact the administrators by email if needed.
","Booster paper has currently 6 citations (since April 2018).
","6","1","Renewing Felsenstein’s phylogenetic bootstrap in the era of big data, F. Lemoine, J.-B. Domelevo Entfellner, E. Wilkinson, D. Correia, M. Dávila Felipe, T. De Oliveira & O. Gascuel, Nature, volume 556, pages 452–456 (2018).
DOI : 10.1038/s41586-018-0043-0"," ","Strategy is guided by the principal investigator and the main developers of the resource.
","No personal data is stored during the computations. If that changes, we may write a proper terms of use.
","There is no specific ethics policy.
","The resource is still young, but we plan to maintain it for a long time, with the help of the Research Engineers involved in the project.
","be registered in the IFB catalogue of tools
be registered as an ELIXIR service (in its SDP)
"," "
"Galaxy South Green Instance","Jean-François Dufayard","South Green","CIRAD","av. Agropolis, 34000 Montpellier","jean-francois.dufayard@cirad.fr"," "," "," "," "," ","Galaxy is an alternative to command line bioanalysis; it allows users that are not comfortable with Linux and cluster commands to manage some complexe bioinformatic analysis. There are several Galaxy services in Europe, but the South Green server is dedicated to plant genome analysis, and offer some specific tools and workflows (SNP calling, SNP analysis, GWAS, phylogenetics, mosaic genome analysis…). This is the only Galaxy service in Europe that is dedicated to such a biological subject. 

Availability:
http://galaxy.southgreen.fr/galaxy/
For developers:
https://github.com/SouthGreenPlatform/galaxy-wrappers
We are planning to add tools and workflows as a view of the European UseGalaxy server.
https://galaxy.uni-freiburg.de/
This server is widely opened to the community, and anyone can create an account freely with the minimal storing quota (20 Go) which are sufficient for many analyses. Full access is possible, according the economical model of the South Green platform. 
The South Green Galaxy server rely on 200 computing nodes, with 32Go of RAM for each job. 
The service counts actually 200 users. 
","Data
Tool
Compute
Interoperability
Training
","The Galaxy South Green server is an opened online web platform dedicated to crop genome analysis. It offers all the classical Galaxy bioinformatic tools, and more than 100 specific Galaxy wrappers and 9 pre-configured workflows designed for recurrent analyses such as NGS mapping/cleaning, RNAseq, SNP calling and filtering, Genome-Wide Association Study, basic population genetics, genomic structural variations detection, metagenomics and phylogenetics. We also developed innovative solution to graphically display outputs of each workflows.
Home-made Galaxy wrappers have been deposited in our local/central toolshed (http://galaxy.southgreen.fr/toolshed/) or in github (https://github.com/SouthGreenPlatform/galaxy-wrappers). Galaxy is extensively used to conduct capacity building activities. It is currently connected to HPC of several hundred of computing nodes, and a NAS storing bay, but we are also initiating use of Docker to disseminate some workflows.","The server is used by 200 users from all over the world, and is frequently used as a training platform (Europe, Africa, Asia, South America).","Plant
Galaxy
","2011","Mature","The service is freely available, with basic storage quotas. Users can access the service and use it without creating an account, freely. Extended quotas are available with a simple formulary, according to the South Green economical model. The resource does not have “terms of use and user’s rights” associated. However some in-house tools integrated into are are under GNU General Public License v3.0.","This service relies on the Galaxy Community, that makes evolve Galaxy constantly. The South Green server is maintained by the South Green developpement team, and all the sources are shared and available on GitHub. https://github.com/SouthGreenPlatform/galaxy-wrappers
The South Green Galaxy community is very active in the national and international Galaxy community (hosting of the GCC 2017 conference, organisation of the European Galaxy Day 2018, participating to the France Elixir node Galaxy working group), which is a good indicator of the constant investment of our community to such a service.
The resource is regularly updated with new tools or workflows (several times a years). The helpdesk is provided via a dedicated mailing list.
Numerous trainings have been provided using the South Green Galaxy instance. For instance, a dedicated workshop was conducted at GCC2017. In 2018, training is provided in Senegal for several workflows (http://southgreen.fr/content/teaching).
","The service is regularly used by 200 users. Approximately 40 people per year are trained on the South Green Galaxy server, all over the world. ","6","5","The South Green portal: A comprehensive resource for tropical and Mediterranean crop genomics
Guignon Valentin, Hueber Yann, Rouard Mathieu, Bocs Stéphanie, Couvin David, De Lamotte Frédéric, Droc Gaëtan, Dufayard Jean François, El Hassouni Nordine, Farcy Cédric, Gkanogiannis Anestis, Hamelin Chantal, Larivière Delphine, Martin Guillaume, Ortega Enrique, Pitollat Bertrand, Pointet Stéphanie, Ruiz Manuel, Gautier Sarah, Summo Marilyne, This Dominique, Ravel Sébastien, Larmande Pierre, Monat Cécile, Sabot François, Tando Ndomassi, Tranchant-Dubreuil Christine, Sempere Guilhem, Dereeper Alexis. 2016. The South Green portal: A comprehensive resource for tropical and Mediterranean crop genomics Current Plant Biology, 7-8 : 6-9.
http://dx.doi.org/10.1016/j.cpb.2016.12.002
"," ","Currently, the resource does not have a dedicated Scientific Advisory nor user committee. However, the resource is a part of South Green platform and is evaluated like other resources of the platform with a Scientific Advisory board and user committee. Over the past two years, the Galaxy platform was presented in order to receive feedback from users. Prior to the user committee, a survey is sent to platform users to assess the effectiveness of the Galaxy instance","no","no","The service was formerly supported by the ARCAD flagship project from Agropolis fondation Itis now maintained synergically by the whole South Green developer community and with partial support from the GenomeHarvest flagship project from Agropolis fondation .","be registered in the IFB catalogue of tools
be registered as an ELIXIR service (in its SDP)
"," "
