"Name of the service","Name","Laboratory","Institute","Adress","Mail","Name","Laboratory","Institute","Adress","Mail","a. Scope of the service","b. Service category","c. Brief service description","d. Communities served","Please check the ELIXIR communities potentially served","Year of establishment","Life Cycle stage","a. Access to the services","b. Quality of the service","a. Overall usage","Number of publications citing the resource, acknowledgements, ...:","Number of publications where the developers of the ressource are co-authors:","b. Up to 5 key publications describing the resource with their DOI","List of the publications describing the resource","a. Scientific Advisory Board, users committee, ...","b. Terms of Use","c. Ethics policy","Sustainable support and funding","What are your motivation(s) for this application","support from IFB"
"ACD_Tools, PACA-BioInfo / IGS","Claverie","Structural & Genomic Information, Mediterranean Inst. of Microbiology","Aix-Marseille University & CNRS","Luminy Campus, 163, avenue de Luminy, case 934, 13288 Marseille Cedex 09, France","jean-michel.claverie@univ-amu.fr"," "," "," "," "," ","ACD_Tools performs an original statistical test that is applicable to virtually all kind of human activities involving counts, when one wish to detect 
that a significant change between different samplings of the population of events/objects.

The service computes a relatively simple mathematical formula the computer implementation of which is tricky and subject to overflow. The originality of the service is thus the test (this is the sole existing on-line server for it), and its extremely robust implementation.

Three tools are provided:
Tool 1: comparing a pair of counts
Tool1 requests a pair of counts of a given event and the sizes of the two samples. Tool1 returns the probability that the compared samples contain the same
proportion of that event. Tool1 is also helpful to determine the suitable combination of counts and sample sizes required to diagnose differences
reaching a given threshold of statistical significance.
Tool 2: comparing lists of paired counts
Tool2 compares two lists of counts associated to the same set of events drawn from two samples and determine which events exhibit the most
significant differences. An optional normalization procedure is available for overdispersed data. 

Tool 3: pairwise distances of multiple datasets
Tool3 performs the complete set of pairwise comparisons of multiple lists of counts (associated to the same set of events) all at once, delivering
an interactive heat map of their relative distances.


","Tool
Training
","ACDtool is a freely accessible web service (URL: www.igs.cnrs-mrs.fr/acdtool/) proposing 3
types of analyses: 1) the pairwise comparison of individual counts, 
2) pairwise comparisons of arbitrary large lists of counts, 
3) the all-at-once pairwise comparisons of multiple datasets. 
Statistical computations are implemented using standard R functions and can accommodate all practical ranges
of counts as generated by modern omic experiments. ACDtool is well suited for large datasets without replicates.","Anybody can take advantage of the use of this test in the context of any activity involving counts.

The original implementation was targetted towards genomics and transcriptomics. It can be used in a much wider context including population genetics, proteomics, metagenomics, barcoding, medical practice, social sciences,  economics.","Human data (including Rare Diseases, Copy number Variations, Human cell Atlas)
Plant
Marine Metagenomics
Metabolomics
Proteomics
Microbial Biotechnology
Structural bioinformatics
","1997","Emerging","Online services freely accessible to users","- number of entries (unknown, the online service just began)
- response times (virtually instantaneous for all tested data sizes) 
","The initial article describing a specific implementation of the test has been cited 1780 times (200/year). A new article describing the first online service to the test in its more generic form (ACD_Tools) was just published.","1,780","2","Claverie JM, Ta TN. ACDtool: a web-server for the generic analysis of large data sets of counts. Bioinformatics. 2018 Jul 18. 
doi:10.1093/bioinformatics/bty640. PMID: 30020402

Audic S, Claverie JM. The significance of digital gene expression profiles.
Genome Res. 1997 Oct; 7(10):986-95. PubMed PMID: 9331369.


"," ","No","NA","NA","A one shot grant from IFB (2016) - Salary for 2 years
No FTP except for the coordinator. The test is not expected to change much.","be registered in the IFB catalogue of tools
be registered as an ELIXIR service (in its SDP)
support from IFB (action 1.3) expected
","support for the application to become an ELIXIR core resource"
"Phylogeny.fr","Claverie","PACA-BioInfo / IGS","Structural & Genomic Information, Mediterranean Inst. of Microbiology","Luminy Campus, 163, avenue de Luminy, case 934, 13288 Marseille Cedex 09, France","jean-michel.claverie@univ-amu.fr"," "," "," "," "," ","It is a molecular evolution online resource where people bring their sequences and build trees using a wide variety of well tested methods for aligning sequences and compute trees. No previous experience or training is needed. It is targeted for researchers that have a once-in-while need to build trees (and draw the corresponding figure) and do not want to (or cannot) devote time to install programs. It is also a great tool on which to initiate students to phylogenetics and run a practical course for non-specialists.
We don't know of an equivalent resource in terms of the variety of proposed tools and easy access. The service will continue to implement new methods (alignment, tree building, etc) as they are progressively becoming standard in the molecular evolution community.","Tool
Training
","General molecular evolution tools used in phylogenetic analyses.","Researchers without any experience/training in phylogenetics/tree building
Researchers without enough bioinformatic expertise to install phylogenetic and sequence analysis packages in their own laboratory
Professors and teachers of molecular evolution classes - practical courses.
Hundred of universities world-wide are using our service for teaching purposes.","Human data (including Rare Diseases, Copy number Variations, Human cell Atlas)
Plant
Marine Metagenomics
Proteomics
Microbial Biotechnology
","2008","Mature","Online service at :
http://www.phylogeny.fr/
a mirror site (partial) is available at:
http://phylogeny.lirmm.fr/phylo_cgi/index.cgi","-  Standard input format:  FASTA, Genbank, EMBL, Clustal, Phylip, Nexux, NEWICK
-  Monitoring of submitted task (>100,000 unique ID /year)
-  Monitoring of response time
-  Hardware enhancement (when funded)
- User feedback
- Training on site (classes), training online (off site) ","- Number of unique users / year : about 100,000
- Total citations of the two articles describing the resource: 2340.","2,340","2","Dereeper A, et al. Phylogeny.fr: robust phylogenetic analysis for the non-specialist. Nucleic Acids Res. 2008;36(Web Server issue):W465-9. 
doi: 10.1093/nar/gkn180. Epub 2008 Apr 19. PubMed PMID: 18424797. (citations: 2040 ; 280/year)
Dereeper A, Audic S, Claverie JM, Blanc G. BLAST-EXPLORER helps you building datasets for phylogenetic analysis. BMC Evol Biol. 2010 Jan 12;10:8. 
doi:10.1186/1471-2148-10-8. PubMed PMID: 20067610; (citations: 300; 50/year)."," ","User feedback.","NA","NA","No recurrent funding dedicated to Phylogeny.fr.
One shot IBISA grant (hardware+ salaries)(2007)
One shot France Génomique Grant (hardware) (2013)
One shot IFB Grant (salary) (2015)
Two CNRS research assistants + one scientist are looking over the resource part time. (1 FTP)","be registered in the IFB catalogue of tools
be registered as an ELIXIR service (in its SDP)
support from IFB (action 1.3) expected
","support for the application to become an ELIXIR core resource"
"qcGenomics","MENDOZA PARRA MARCO ANTONIO","Genoscope; UMR-8030","François Jacob","2 Gaston Crémieux 91057 Evry cedex","marco@igbmc.fr"," "," "," "," "," ","Modern functional genomics studies relies on the combination of massive parallel DNA sequencing with chromatin immunoprecipitation assay (known as ChIP-sequencing) or a large variety of DNA-RNA enrichment strategies. Indeed, over the last ten years ChIP-seq and related datasets generated by the scientific community have accumulated in large repositories such as gene expression ommnibus (GEO) or the European nucleotide archive (ENA), representing massive amounts of data which are publicly available for further mining. 
Importantly, data mining over datasets issued from different laboratories, conditions, protocols, sample treatments, etc, might require a critical evaluation of their associated quality (herein corresponding to the evaluation of the signal/background contrast), an aspect that is under-estimated or addressed by simplistic qualitative approaches. Specifically, while a number of analytical methods aiming to address the quality of ChIP-seq datasets have been described, none of them has been shown to be applicable to the large variety of ChIP-seq and enrichment-related NGS profiling assays. In contrast, our proprietary NGS-QC algorithm has been designed to (i) infer a set of global QC indicators (QCis), which reveal the comparability of different enriched NGS data sets, (ii) provide local QCis to judge the robustness of cumulative read counts ('peaks or islands') in a particular region, (iii) provide guidelines for the choice of the optimal sequencing depth for a given target and, finally, (iv) to have quantitative means of comparing different antibodies and antibody batches for ChIP-seq and related antibody-driven studies. 
Currently, our database (publicly available at http://ngs-qc.org) is hosting quality scores for more than 80 thousand profiles, corresponding to virtually all ChIP-seq assays generated by the scientific community, but also other type of functional genomic readouts like ATAC-Seq, DNase-seq, RNA-seq as well as long-range chromatin interaction assays like 4C-seq and Hi-C.
As consequence, the qcGenomics platform (available via the web address http://ngs-qc.org) represents currently an emergent infrastructure for the scientific community, followed by more than 13800 users (since April 2014) issued from different regions on the world (>1000 users from USA; >500 from China; France; >460 from UK; ~200 from Germany; ~180 from India; ~150 from Canada; ~100 from Japan; etc). Furthermore, in addition to 5 scientific articles published by the team of qcGenomics (NAR 2013; Genomics Data 2014; F1000Res 2016; Statistical Genomics Springer Book Series 2016; BMC Genomics; 2016), 38 citations making reference to this platform are available, clearly demonstrating the interest and the utility of our database to the scientific community.
Furthermore, this database is currently evolving from a qualification to an integrative platform, in which users can (i) retrieve public datasets and their associated quality scores; (ii) visualize their enrichment patterns into our dedicated genome browser where local quality scores are also displayed; (iii) compare up to hundreds datasets on the basis of (pre-computed) similarity index scores; (iv) characterize co-occurring events by the inference of combinatorial states in a genomic context. A manuscript describing these new computational solutions available in our platform is under preparation.

Overall, these solutions - available under the qcGenomics platform - provide to the scientific community, means to interrogate public data without the necessity of directly recovering the raw data, thus decreasing the hurdle associated the necessity of having the computational skills and infrastructure for it, and by consequence making the mining of this type of data accessible to any laboratory over the world.","Data
Tool
","qcGenomics recovers publicly available raw data (fastq files) from GEO by the use of our customized scripts. After reads alignment to the corresponding genome, our proprietary NGS-QC algorithm allows to infer local and global quality scores which are then made available to the scientific community, together with a curated version of the available metadata (the curation procedure is composed by a machine-driven strategy for the identification of the cell/tissue-type, target molecule associated to the dataset, followed by an expert curation process for the identification of the potential cell/tissue type treatments described on the metadata but not easily retrieved by an automated text-mining strategy).","qcGenomics is focused on functional genomic readouts which are generated by the international community. As consequence, qcGenomics host data issued from model organisms but also from human samples.","Human data (including Rare Diseases, Copy number Variations, Human cell Atlas)
Plant
","2014","Emerging","qcGenomics is a freely accessible platform, where users can retrieve quality scores for publicly available datasets, but also compute quality scores for their own private data (under our dedicated galaxy instance). Importantly, users using our galaxy instance obtain a user account as a way to keep the confidentiality. ","One of our first missions is to sensitize the community to the necessity of taking care of the quality of the data. At this respect, as part of our website, we have included several elements aiming at discussing the necessity for quality descriptors for functional genomics data (http://www.ngs-qc.org/whyngsqc.php) , as well as the strategies that we have setup to address this problem. Specifically, we have elaborated a detailed tutorial (http://www.ngs-qc.org/tutorial.php)  explaining in one hand the procedure by which we infer quality scores for this type of NGS data, but also the approach to follow in our website to retrieve and integrate public data (http://www.ngs-qc.org/qcgenomics/).","The qcGenomics platform is currently followed by more than 13800 users (since April 2014) issued from different regions over the world (>1000 users from USA; >500 from China; France; >460 from UK; ~200 from Germany; ~180 from India; ~150 from Canada; ~100 from Japan; etc). 

Furthermore, in addition to 5 scientific articles published by the team of qcGenomics (NAR 2013; Genomics Data 2014; F1000Res 2016; Statistical Genomics Springer Book Series 2016; BMC Genomics; 2016), 38 citations making reference to this platform are available, clearly demonstrating the interest and the utility of our database to the scientific community.
","38","5","- Marco Antonio Mendoza-Parra, Wouter Van Gool, Mohamed Saleem MA, Danilo Guillermo Ceschin and Hinrich Gronemeyer; A quality control system for
profiles obtained by massive parallel sequencing ; Nucleic Acid Research; 2013 Nov 1; 41(21):e196. doi: 10.1093/nar/gkt829. [IF 9.112] (PATENTED)

- Marco A. Mendoza-Parra and Hinrich Gronemeyer; Assessing quality standards for ChIP-seq and related massive parallel sequencing-generated
datasets: When rating goes beyond avoiding the crisis; Genomics Data; Dec. 2014; vol. 2, pages 268-273. doi: 10.1016/j.gdata.2014.08.002.

- Marco Antonio Mendoza-Parra, Vincent Saravaki, Pierre-Etienne Cholley,Matthias Blum, Benjamin Billoré and Hinrich Gronemeyer; Antibody
performance in ChIP-sequencing assays: From quality scores of public data sets to quantitative certification; F1000Research; 12 January 2016;
5:14; doi: 10.12688/f1000research.7637.2

- Marco A. Mendoza-Parra, Mohamed Saleem MA, Matthias Blum, Pierre-Etienne Cholley and Hinrich Gronemeyer; NGS-QC Generator: A Quality control
system for ChIP-seq and related deep sequencing-generated datasets; Statistical Genomics : Methods and Protocols; Springer Book Series; 24
March 2016; Volume 1418; pp 243-65. doi: 10.1007/978-1-4939-3578-9_13

- Marco Antonio Mendoza-Parra, Matthias Blum, Valeriya Malysheva, Pierre-Etienne Cholley and Hinrich Gronemeyer; LOGIQA: A database dedicated to
Long-range Genome Interactions Quality Assessment ; BMC Genomics; 16 May 2016, 17 (1), 355. [IF 3.986]; doi: 10.1186/s12864-016-2642-1"," ","No","As part of the our website, we have described the terms & conditions of use of our resource (http://www.ngs-qc.org/terms.php)","As part of the our website, we have described the terms & conditions of use of our resource (http://www.ngs-qc.org/terms.php) as well as the privacy policy to which we are engaged in the context of the processing of users data (http://www.ngs-qc.org/policy.php).","qcGenomics has been developed inside of the H. Gronemeyer's team at the IGBMC in Strasbourg. Since 2013, the team has supported this effort by financing the recruitment of bioinformaticians (1 in 2013 - 2014; 2 in 2014-2017; 1 in 2017-2018) and by the establishment of a dedicated infrastructure (4 servers - each of them with 40 cores and 125Gb RAM, and >50 Tb storage space fully financed by the team Gronemeyer). In 2018 the team is closing since H. Gronemeyer is getting in retirement. Considering that Marco Mendoza is at the basis of this development, qcGenomics is moving in September 2018 to the Genoscope in Evry as part of the establishment of his independent team. This new team is hiring a bioinformatician which will be responsible to handle the maintenance of the qcGenomics service (1 year contract financed by the Genopole starting Grant ATIGE).
It is clear that on the basis of the ambitions behind this project, a larger bioinformatics team is required and that taking in consideration the relevance of this effort in an international landscape, the support of the IFB as part of a national resource, but also in an European context via the ELIXIR program might give the required strength to continue with this effort.
","be registered in the IFB catalogue of tools
be registered as an ELIXIR service (in its SDP)
support from IFB (action 1.3) expected
","IT support (computation/storage)
curation (tools and network of experts)
support for the application to become an ELIXIR core resource
"
"HiC-Pro","Servant","Bioinformatics platform","Institut Curie","26 rue d'Ulm, 75005 Paris","nicolas.servant@curie.fr"," "," "," "," "," ","HiC-Pro is a complete pipeline for Hi-C data processing, starting from raw sequencing reads to normalized contact maps. It supports most of the Hi-C protocols, including Hi-C, HiChIP, DNase Hi-C, MNase Hi-C, capture Hi-C etc. 
It is efficient, flexible and scalable, and can operate either on a single laptop or on a computational cluster. HiC-Pro is sequential and each step of the workflow can be run independantly. In addition, HiC-Pro allows to do allele-specific analysis when the parental genotypes are available.

HiC-Pro was published in late 2015. So far, the paper has been cited in more that 90 other studies, making HiC-Pro one of the most popular tool for Hi-C data processing.
HiC-Pro is now compatible with many downstream analysis tools that are frequently used in Hi-C data analysis. The HiC-Pro outputs can easily be transformed to be loaded in the two main tools for Hi-C data visualization (Juicebox and Higlass). 

The project is still in active development with a new version in average every 6 months. A active forum is available to report bugs and requests, with currently 147 registered users. ","Tool","HiC-Pro is an optimized and flexible pipeline for processing Hi-C data from raw reads to normalized contact maps. HiC-Pro maps reads, detects valid ligation products, performs quality controls and generates intra- and inter-chromosomal contact maps. It includes a fast implementation of the iterative correction method and is based on a memory-efficient data format for Hi-C contact maps. In addition, HiC-Pro can use phased genotype data to build allele-specific contact maps. We applied HiC-Pro to different Hi-C datasets, demonstrating its ability to easily process large data in a reasonable time. Source code and documentation are available at http://github.com/nservant/HiC-Pro.","The tool is dedicated to bioinformaticians and biologists analysing Hi-C data.
It is also used by some sequencing/bioinformatics facilities involved in Hi-C data preparation/processing. 
The quality controls and the reporting provided by HiC-Pro can be of great interest to validate each steps of the protocols as well as the overall data quality. ","Human data (including Rare Diseases, Copy number Variations, Human cell Atlas)","2015","Mature","HiC-Pro is freely available at https://github.com/nservant/HiC-Pro under the BSD-3 Licence","HiC-Pro is fully documented (http://nservant.github.io/HiC-Pro/), and a dedicated forum was created in 2016 (https://groups.google.com/forum/#!forum/hic-pro).
","Since its publication, HiC-Pro has been cited many times in the litterature in the past 3 years (90 citations sources Google scholar, 71 citations source Genome Biology). The github project is active, with 57 forks and more than 400 commits on the project.","90","1","https://doi.org/10.1186/s13059-015-0831-x"," ","There is no commitee","The software is publically available under the BSD-3 licence","No ethics policy","The HiC-Pro development was supported by the France Genomique National infrastructure (ANR-10-INBS-09), the Labex Deep, the European Research Coucil (SMAC-ERC-280032), the ERC Advanced Investigator award (ERC- 250367), the European Commission (HEALTH-F5-2012-305626), the ABS4NGS project (ANR-11-BINF-0001), the National Human Genome Research Institute (R01HG003143), and the Paris Alliance of Cancer Research Institutes (PACRI-ANR).","be registered in the IFB catalogue of tools"," "
"ReMap","Benoit Ballester","TAGC","INSERM U1090","163 Avenue de Luminy","benoit.ballester@inserm.fr"," "," "," "," "," ","ReMap is unique collection of regulatory regions in human, as a result of a large-scale integrative analysis of ChIP-seq experiments for hundreds of transcriptional regulators (TRs) such as transcription factors, transcriptional co-activators and chromatin regulators. 

ReMap has been the first large scale integrative initiative to study these data, offering significant insights into the complexity of the human regulatory landscape. The ReMap 2015 resource created a large catalog of regulatory regions by compiling the genomic localization of 132 different TRs across 83 different human cell lines and tissue types based on 395 non-ENCODE datasets selected from Gene Expression Omnibus and ArrayExpress. This catalog was merged with the ENCODE multi-cell peaks, generating a global map of 13M regulatory elements for 237 TRs across multiple cell types. However, since the 2015 publication of ReMap, an even greater number of ChIP-seq assays has been submitted to genomic data repositories.

ReMap 2018 update, which includes the integration of 2829 quality controlled ChIP-seq datasets for TFs, TCAs and CRFs. The new ChIP-seq datasets have been mapped to the GRCh38/hg38 human assembly, quality filtered and analyzed with a uniform pipeline. We propose a unified integration of all public ChIP-seq datasets producing a unique atlas of regulatory regions for 485 TRs across 346 cell types, for a total of 80M DNA binding regions.
The manual curation specific to the ReMap initiative offers a unique and unprecedented collection of TR binding regions. ","Data
Tool
","Database is the result of expert curation of ChIP-Seq data, allowing for unified analysis and integration of regulatory regions from thousands of ChIP-Seq experiements sitting in data wharehouse.  ","International community served, interested in human genome annotation especially in gene regulation, regulatoty genomics.","Human data (including Rare Diseases, Copy number Variations, Human cell Atlas)","2014","Emerging","The ReMap resource is available at remap.cisreg.eu , we provide data files dump, and data available via 
Web display : remap.cisreg.eu
Browsing via track Hubs at UCSC and Ensembl http://pedagogix-tagc.univ-mrs.fr/remap/index.php?page=browse
Track Hub Registry : https://trackhubregistry.org/search/view_trackhub/AV9AQ5RK4aHzXASwhvHM
Downloading data : http://pedagogix-tagc.univ-mrs.fr/remap/index.php?page=download ","Data formated in BED, FASTA.
We aim for a 2y release cycle
We monitor via Google Analytics
2,300 users from 01/01/2018 to 01/08/2018
4,600 sessions from 01/01/2018 to 01/08/2018","We have daily visits to the ressources, and our publications are citied in various and high impact journals (See links)
68 citations for ReMap 2015 (https://goo.gl/R96rEh) 
8 citations for ReMap 2018 (https://goo.gl/P5trmL)
Our data is avaible at the USCS Genome Browser and Ensembl (via track hub)","76","10","ReMap 2018: An updated regulatory regions atlas from an integrative analysis of DNA-binding ChIP-seq experiments. 
Cheneby J., Gheorghe M., Artufel M., Mathelier A., Ballester, B. 
Nucleic Acids Research, gkx1092, 
https://doi.org/10.1093/nar/gkx1092

Integrative analysis of public ChIP-seq experiments reveals a complex multi-cell regulatory landscape. 
Griffon, A., Barbier, Q., Dalino, J., van Helden, J., Spicuglia, S., Ballester, B. 
Nucleic Acids Research, Volume 43, Issue 4, 27 February 2015 
https://doi.org/10.1093/nar/gku1280"," ","No SAB for ReMap, not big enough..yet","We are working on description of cookies (the only one are from Analytics). ","Not sure if an ethics policy applies to our database. ","We are working hard to get supports for ReMap, allowing for secure and regular update. 
ReMap is developed by PhD and master students for the past 4 years. ","be registered in the IFB catalogue of tools
be registered as an ELIXIR service (in its SDP)
support from IFB (action 1.3) expected
","IT support (computation/storage)
curation (tools and network of experts)
support for the application to become an ELIXIR core resource
"
